{
  "broadcaster": {
    "is_anonymous": false,
    "user_id": 123456789,
    "username": "test_streamer",
    "is_verified": false,
    "profile_picture": "https://example.invalid/kick-sim/test_streamer.png",
    "channel_slug": "test-streamer"
  },
  "moderator": {
    "is_anonymous": false,
    "user_id": 987654321,
    "username": "test_moderator",
    "is_verified": false,
    "profile_picture": "https://example.invalid/kick-sim/test_moderator.png",
    "channel_slug": "test-moderator"
  },
  "banned_user": {
    "is_anonymous": false,
    "user_id": 987654322,
    "username": "test_viewer",
    "is_verified": false,
    "profile_picture": "https://example.invalid/kick-sim/test_viewer.png",
    "channel_slug": "test-viewer"
  },
  "metadata": {
    "reason": "Kick Sim moderation test",
    "created_at": "{{ now() }}",
    "expires_at": null
  }
}
